{
  "schemaVersion": 1,
  "mode": "existing-project",
  "targetId": "bodycam",
  "gameIdentity": "Bodycam",
  "objective": "重构现有英文 Bodycam 攻略站；保留原项目和研究资料，在隔离候选目录验收后提供写回及 GitHub/Vercel 发布计划。",
  "rawKeywordsFile": "/Users/randyz/work/coding/hot_words_web/gameweb/game_bodycam/background_information/keyword-materials/关键词.md",
  "canonicalOrigin": "https://bodycamwiki.top",
  "repository": "randyzer/game_bodycam",
  "deploymentProvider": "Vercel",
  "adRequested": true,
  "adSnippetRef": "bodycam-ad.html",
  "allowedOperations": ["read-source", "write-candidate"],
  "promotionPolicy": "review-required",
  "gameMetadata": {
    "verification": "USER_SUPPLIED_NOT_CURRENTLY_VERIFIED",
    "steamAppId": "2406770",
    "platform": "PC / Steam / Windows 10 & 11",
    "developer": "Reissad Studio",
    "publisher": "Reissad Studio",
    "engine": "Unreal Engine 5",
    "releaseStatus": "Early Access",
    "earlyAccessRelease": "2024-06-07",
    "officialWebsite": "https://www.playbodycam.com/en-US",
    "steam": "https://store.steampowered.com/app/2406770/Bodycam/",
    "steamCommunity": "https://steamcommunity.com/app/2406770/",
    "igdb": "https://www.igdb.com/games/bodycam",
    "officialX": "https://x.com/ReissadStudio",
    "officialYouTube": "https://www.youtube.com/@ReissadStudio",
    "discord": "https://discord.gg/reissadstudio",
    "reddit": "https://www.reddit.com/r/BodycamGame/",
    "targetLanguage": "English",
    "targetMarket": "US and English PC Gaming first"
  }
}
